{
  "version": 1,
  "id": "scan-20261015T182735Z",
  "createdAt": "2026-10-15T18:27:35.290Z",
  "tool": {
    "name": "specguard",
    "version": "0.1.3"
  },
  "items": [
    {
      "id": "sec-05cfa7757d34",
      "title": "No access control or authentication requirement for MCP tools exposing workspace graph and drift data",
      "severity": "critical",
      "type": "spec",
      "change": "spec",
      "summary": "Add a requirement specifying that MCP tool endpoints must authenticate callers (e.g., via a shared secret, token, or OS-level restriction) and that only principals with explicit workspace-read permission may invoke read tools; only principals with workspace-write permission may invoke commands that write files or trigger drift runs.",
      "findings": [
        {
          "id": "workspaces:missing-authorization",
          "detector": "spec-review",
          "ruleId": "missing-authorization",
          "message": "The MCP tools `specguard_contracts`, `specguard_impact`, `specguard_workspace_status`, and `specguard_workspace_drift` are listed as interfaces but no requirement specifies who may invoke them, what authentication is needed, or how authorization is enforced. These tools expose the full cross-repo contract graph, spec paths, API surface names, and drift status. An unauthenticated caller could enumerate the entire system topology or trigger drift runs against arbitrary repos listed in the manifest.",
          "file": "specs/capabilities/workspaces.md"
        }
      ],
      "capability": "workspaces",
      "claims": [],
      "files": [
        "specs/capabilities/workspaces.md"
      ],
      "verify": {
        "scope": "listed",
        "claims": []
      },
      "fingerprint": "05cfa7757d34",
      "status": "open",
      "statusHistory": []
    },
    {
      "id": "sec-36d778e91e0c",
      "title": "npm plugin loader lacks package-name validation against path/URL injection",
      "severity": "critical",
      "type": "spec",
      "change": "spec",
      "summary": "Add a requirement: at config-load time, each npm plugin entry's `package` value MUST match the npm package-name regex (`^(@[a-z0-9-~][a-z0-9-._~]*/)?[a-z0-9-~][a-z0-9-._~]*$`); any entry that does not match MUST be rejected as a configuration error with exit code 1 before any plugin code is imported, and the error message MUST name the offending entry.",
      "findings": [
        {
          "id": "integration-surfaces:missing-authorization",
          "detector": "spec-review",
          "ruleId": "missing-authorization",
          "message": "The spec states npm plugins load only from an explicit `{name, package}` allowlist with 'package names restricted to npm names (no paths or URLs)'. However, no requirement defines what constitutes a valid npm package name, who enforces that restriction, what the rejection behavior is (exit code, error message), or whether the allowlist itself is validated at config-load time versus at plugin-load time. A malicious or misconfigured config entry such as `{name: 'x', package: '../evil'}` or `{name: 'x', package: 'https://evil.com/pkg'}` could execute arbitrary code. The requirement is stated as a goal but never operationalised as a testable rule.",
          "file": "specs/capabilities/integration-surfaces.md"
        }
      ],
      "capability": "integration-surfaces",
      "claims": [
        "capabilities/integration-surfaces#planned-plugin-extensions",
        "capabilities/integration-surfaces#plugin-contract"
      ],
      "files": [
        "specs/capabilities/integration-surfaces.md"
      ],
      "verify": {
        "scope": "listed",
        "claims": []
      },
      "fingerprint": "36d778e91e0c",
      "status": "open",
      "statusHistory": []
    },
    {
      "id": "sec-82f1b3d37d83",
      "title": "No requirement governs who may invoke validation or the MCP tool against arbitrary URLs",
      "severity": "critical",
      "type": "spec",
      "change": "spec",
      "summary": "Add a requirement that (a) the MCP tool enforces caller authentication before accepting any validation request, and (b) a URL allowlist/denylist configuration controls which base URLs the agent is permitted to target, with production-like hostnames blocked by default unless explicitly whitelisted.",
      "findings": [
        {
          "id": "agentic-verification:missing-authorization",
          "detector": "spec-review",
          "ruleId": "missing-authorization",
          "message": "The CLI and MCP tool accept a `--url` base-URL override and a `--allow-outbound` flag with no requirement specifying authentication, authorization, or access control over who may point the agent at an arbitrary target. An unauthorized user (or a malicious CI actor) could redirect the agent to a production environment or an attacker-controlled server, causing credential exposure via outbound requests or exfiltrating page content captured in evidence. No requirement limits which URLs are permissible targets or requires any form of caller authentication for the MCP tool surface.",
          "file": "specs/capabilities/agentic-verification.md"
        }
      ],
      "capability": "agentic-verification",
      "claims": [
        "capabilities/agentic-verification#validate-targets",
        "capabilities/agentic-verification#guardrail-blocking"
      ],
      "files": [
        "specs/capabilities/agentic-verification.md"
      ],
      "verify": {
        "scope": "listed",
        "claims": [
          "capabilities/agentic-verification#action-classification",
          "capabilities/agentic-verification#auth-failures-and-cache",
          "capabilities/agentic-verification#auth-strategies",
          "capabilities/agentic-verification#browser-lifecycle",
          "capabilities/agentic-verification#credentials-never-leak",
          "capabilities/agentic-verification#criterion-verdicts",
          "capabilities/agentic-verification#evidence-and-history",
          "capabilities/agentic-verification#guardrail-blocking",
          "capabilities/agentic-verification#ledger-proof",
          "capabilities/agentic-verification#one-context-per-profile",
          "capabilities/agentic-verification#validate-exit-code",
          "capabilities/agentic-verification#validate-targets",
          "capabilities/agentic-verification#value-judgement",
          "capabilities/agentic-verification#verify-proof-matching",
          "capabilities/agentic-verification#verify-value-fails",
          "capabilities/agentic-verification#verify-walks-journeys"
        ]
      },
      "fingerprint": "82f1b3d37d83",
      "status": "open",
      "statusHistory": []
    },
    {
      "id": "sec-a1ed06b4c0db",
      "title": "No access control on inbox file containing redacted but sensitive prompt data",
      "severity": "critical",
      "type": "spec",
      "change": "spec",
      "summary": "Add a requirement that `history inbox` creates `.specguard/history/inbox.jsonl` with owner-read/write-only permissions (mode 0600 on POSIX systems) and that `history add` / `history capture` create committed entry files with at most 0644. Document the expected umask or explicit chmod call.",
      "findings": [
        {
          "id": "requirement-history:missing-authorization",
          "detector": "spec-review",
          "ruleId": "missing-authorization",
          "message": "The spec states that prompts 'routinely contain secrets, customer data and internal URLs' and that the inbox file at `.specguard/history/inbox.jsonl` is uncommitted and gitignored. However, no requirement specifies file-system permissions for the inbox file (e.g., mode 0600) or for the `specs/history/` directory. Any local user or process with access to the working directory can read the inbox, which may contain prompt text that survived redaction or partial redaction. The Security & Data Considerations section acknowledges the sensitivity but only mentions gitignore, not filesystem access controls.",
          "file": "specs/capabilities/requirement-history.md"
        }
      ],
      "capability": "requirement-history",
      "claims": [
        "capabilities/requirement-history#history-inbox-capture",
        "capabilities/requirement-history#history-redaction"
      ],
      "files": [
        "specs/capabilities/requirement-history.md"
      ],
      "verify": {
        "scope": "listed",
        "claims": []
      },
      "fingerprint": "a1ed06b4c0db",
      "status": "open",
      "statusHistory": []
    },
    {
      "id": "sec-aa788e09ece8",
      "title": "No authentication or authorization requirement on `security plan set-status` CLI and plan lifecycle API",
      "severity": "critical",
      "type": "spec",
      "change": "spec",
      "summary": "Add a requirement specifying that `security plan set-status` and any API endpoint that mutates plan state must authenticate the caller (e.g., via a configured token or OS-level permission check) and that unauthenticated or unauthorized mutation attempts are rejected with a non-zero exit code and a logged audit entry.",
      "findings": [
        {
          "id": "security-and-remediation:missing-authorization",
          "detector": "spec-review",
          "ruleId": "missing-authorization",
          "message": "The spec defines `security plan set-status` as the mechanism by which external trackers update plan item statuses (plan-lifecycle, plan-transitions), and the documentation API serves plans. However, no requirement specifies who is permitted to call `set-status`, what credentials or roles are required, or how the CLI or API authenticates callers. An unauthenticated actor could arbitrarily mark open vulnerabilities as 'wont-fix' or 'verified', silently suppressing real findings. The Security & Data Considerations section mentions LLM key handling but says nothing about access control for plan mutation.",